<?xml version="1.0" encoding="UTF-8"?>
<xs:schema xmlns:xs="http://www.w3.org/2001/XMLSchema">
	<xs:element name="musicos">
		<xs:complexType>
			<xs:sequence>
				<xs:element ref="musico" maxOccurs="unbounded">
				</xs:element>
			</xs:sequence>
		</xs:complexType>
	</xs:element>
	<xs:element name="musico">
		<xs:complexType>
			<xs:sequence>
				<xs:element name="nombre" type="xs:string" />
				<xs:element name="apodo" type="xs:string" minOccurs="0" />
				<xs:element name="fechaNacimiento" type="xs:string" />
			</xs:sequence>
		</xs:complexType>
	</xs:element>
</xs:schema>
